{
  "$schema": "https://json-schema.org/draft/2020-12/schema",
  "title": "Receipt Template Data",
  "type": "object",
  "additionalProperties": false,
  "required": [
    "document_title",
    "company_name",
    "company_address",
    "company_city",
    "company_tax_id",
    "client_name",
    "client_email",
    "client_phone",
    "receipt_number",
    "reference",
    "description",
    "price",
    "units",
    "discount",
    "partial_amount",
    "total",
    "payment_method",
    "payment_date"
  ],
  "properties": {
    "document_title": { "type": "string" },
    "company_name": { "type": "string" },
    "company_address": { "type": "string" },
    "company_city": { "type": "string" },
    "company_tax_id": { "type": "string" },
    "client_name": { "type": "string" },
    "client_email": { "type": "string", "format": "email" },
    "client_phone": { "type": "string" },
    "receipt_number": { "type": "string" },
    "reference": { "type": "string" },
    "description": { "type": "string" },
    "price": { "type": "string" },
    "units": { "type": "string" },
    "discount": { "type": "string" },
    "partial_amount": { "type": "string" },
    "total": { "type": "string" },
    "payment_method": { "type": "string" },
    "payment_date": { "type": "string" }
  }
}
