{
  "document_title": "{{document_title}}",
  "company_name": "{{company_name}}",
  "company_address": "{{company_address}}",
  "company_city": "{{company_city}}",
  "company_tax_id": "{{company_tax_id}}",
  "client_name": "{{client_name}}",
  "client_email": "{{client_email}}",
  "client_phone": "{{client_phone}}",
  "receipt_number": "{{receipt_number}}",
  "reference": "{{reference}}",
  "description": "{{description}}",
  "price": "{{price}}",
  "units": "{{units}}",
  "discount": "{{discount}}",
  "partial_amount": "{{partial_amount}}",
  "total": "{{total}}",
  "payment_method": "{{payment_method}}",
  "payment_date": "{{payment_date}}"
}
